SOCLevelCode,SOCDetailCode,SOCDetailTitle,SOCDetailDescription
27-3043.00,27-3043.05,"Poets, Lyricists and Creative Writers","Create original written works, such as scripts, essays, prose, poetry or song lyrics, for publication or performance."
29-1071.00,29-1071.01,Anesthesiologist Assistants,Assist anesthesiologists in the administration of anesthesia for surgical and non-surgical procedures. Monitor patient status and provide patient care during surgical treatment.
29-1122.00,29-1122.01,"Low Vision Therapists, Orientation and Mobility Specialists, and Vision Rehabilitation Therapists","Provide therapy to patients with visual impairments to improve their functioning in daily life activities. May train patients in activities such as computer use, communication skills, or home management skills."
29-1129.00,29-1129.01,Art Therapists,"Plan or conduct art therapy sessions or programs to improve clients' physical, cognitive, or emotional well-being."
29-1129.00,29-1129.02,Music Therapists,"Plan, organize, direct, or assess clinical and evidenced-based music therapy interventions to positively influence individuals' physical, psychological, cognitive, or behavioral status."
29-1141.00,29-1141.01,Acute Care Nurses,"Provide advanced nursing care for patients with acute conditions such as heart attacks, respiratory distress syndrome, or shock. May care for pre- and post-operative patients or perform advanced, invasive diagnostic or therapeutic procedures."
29-1141.00,29-1141.02,Advanced Practice Psychiatric Nurses,"Assess, diagnose, and treat individuals and families with mental health or substance use disorders or the potential for such disorders. Apply therapeutic activities, including the prescription of medication, per state regulations, and the administration of psychotherapy."
29-1141.00,29-1141.03,Critical Care Nurses,Provide specialized nursing care for patients in critical or coronary care units.
29-1141.00,29-1141.04,Clinical Nurse Specialists,"Direct nursing staff in the provision of patient care in a clinical practice setting, such as a hospital, hospice, clinic, or home. Ensure adherence to established clinical policies, protocols, regulations, and standards."
29-1229.00,29-1229.01,Allergists and Immunologists,"Diagnose, treat, and help prevent allergic diseases and disease processes affecting the immune system."
29-1229.00,29-1229.02,Hospitalists,"Provide inpatient care predominantly in settings such as medical wards, acute care units, intensive care units, rehabilitation centers, or emergency rooms. Manage and coordinate patient care throughout treatment."
29-1229.00,29-1229.03,Urologists,"Diagnose, treat, and help prevent benign and malignant medical and surgical disorders of the genitourinary system and the renal glands."
29-1229.00,29-1229.04,Physical Medicine and Rehabilitation Physicians,"Diagnose and treat disorders requiring physiotherapy to provide physical, mental, and occupational rehabilitation."
29-1229.00,29-1229.05,Preventive Medicine Physicians,"Apply knowledge of general preventive medicine and public health issues to promote health care to groups or individuals, and aid in the prevention or reduction of risk of disease, injury, disability, or death. May practice population-based medicine or diagnose and treat patients in the context of clinical health promotion and disease prevention."
29-1229.00,29-1229.06,Sports Medicine Physicians,"Diagnose, treat, and help prevent injuries that occur during sporting events, athletic training, and physical activities."
29-1299.00,29-1299.01,Naturopathic Physicians,"Diagnose, treat, and help prevent diseases using a system of practice that is based on the natural healing capacity of individuals. May use physiological, psychological or mechanical methods. May also use natural medicines, prescription or legend drugs, foods, herbs, or other natural remedies."
29-1299.00,29-1299.02,Orthoptists,Diagnose and treat visual system disorders such as binocular vision and eye movement impairments.
29-2011.00,29-2011.01,Cytogenetic Technologists,"Analyze chromosomes or chromosome segments found in biological specimens, such as amniotic fluids, bone marrow, solid tumors, and blood to aid in the study, diagnosis, classification, or treatment of inherited or acquired genetic diseases. Conduct analyses through classical cytogenetic, fluorescent in situ hybridization (FISH) or array comparative genome hybridization (aCGH) techniques."
29-2011.00,29-2011.02,Cytotechnologists,"Stain, mount, and study cells to detect evidence of cancer, hormonal abnormalities, and other pathological conditions following established standards and practices."
29-2011.00,29-2011.04,Histotechnologists,Apply knowledge of health and disease causes to evaluate new laboratory techniques and procedures to examine tissue samples. Process and prepare histological slides from tissue sections for microscopic examination and diagnosis by pathologists. May solve technical or instrument problems or assist with research studies.
29-2012.00,29-2012.01,Histology Technicians,Prepare histological slides from tissue sections for microscopic examination and diagnosis by pathologists. May assist with research studies.
29-2099.00,29-2099.01,Neurodiagnostic Technologists,"Conduct electroneurodiagnostic (END) tests such as electroencephalograms, evoked potentials, polysomnograms, or electronystagmograms. May perform nerve conduction studies."
29-2099.00,29-2099.05,Ophthalmic Medical Technologists,"Assist ophthalmologists by performing ophthalmic clinical functions and ophthalmic photography. Provide instruction and supervision to other ophthalmic personnel. Assist with minor surgical procedures, applying aseptic techniques and preparing instruments. May perform eye exams, administer eye medications, and instruct patients in care and use of corrective lenses."
29-2099.00,29-2099.08,Patient Representatives,"Assist patients in obtaining services, understanding policies and making health care decisions."
29-9099.00,29-9099.01,Midwives,Provide prenatal care and childbirth assistance.
31-9099.00,31-9099.01,Speech-Language Pathology Assistants,"Assist speech-language pathologists in the assessment and treatment of speech, language, voice, and fluency disorders. Implement speech and language programs or activities as planned and directed by speech-language pathologists. Monitor the use of alternative communication devices and systems."
31-9099.00,31-9099.02,Endoscopy Technicians,Maintain a sterile field to provide support for physicians and nurses during endoscopy procedures. Prepare and maintain instruments and equipment. May obtain specimens.
33-3021.00,33-3021.02,Police Identification and Records Officers,"Collect evidence at crime scene, classify and identify fingerprints, and photograph evidence for use in criminal and civil cases."
33-3021.00,33-3021.06,Intelligence Analysts,"Gather, analyze, or evaluate information from a variety of sources, such as law enforcement databases, surveillance, intelligence networks or geographic information systems. Use intelligence data to anticipate and prevent organized crime activities, such as terrorism."
33-3051.00,33-3051.04,Customs and Border Protection Officers,"Investigate and inspect persons, common carriers, goods, and merchandise, arriving in or departing from the United States or between states to detect violations of immigration and customs laws and regulations."
33-9099.00,33-9099.02,Retail Loss Prevention Specialists,"Implement procedures and systems to prevent merchandise loss. Conduct audits and investigations of employee activity. May assist in developing policies, procedures, and systems for safeguarding assets."
35-3023.00,35-3023.01,Baristas,Prepare or serve specialty coffee or other beverages. Serve food such as baked goods or sandwiches to patrons.
39-9011.00,39-9011.01,Nannies,"Care for children in private households and provide support and expertise to parents in satisfying children's physical, emotional, intellectual, and social needs. Duties may include meal planning and preparation, laundry and clothing care, organization of play activities and outings, discipline, intellectual stimulation, language activities, and transportation."
41-4011.00,41-4011.07,Solar Sales Representatives and Assessors,"Contact new or existing customers to determine their solar equipment needs, suggest systems or equipment, or estimate costs."
43-5011.00,43-5011.01,Freight Forwarders,"Research rates, routings, or modes of transport for shipment of products. Maintain awareness of regulations affecting the international movement of cargo. Make arrangements for additional services, such as storage or inland transportation."
47-1011.00,47-1011.03,Solar Energy Installation Managers,Direct work crews installing residential or commercial solar photovoltaic or thermal systems.
47-2152.00,47-2152.04,Solar Thermal Installers and Technicians,"Install or repair solar energy systems designed to collect, store, and circulate solar-heated water for residential, commercial or industrial use."
47-4011.00,47-4011.01,Energy Auditors,"Conduct energy audits of buildings, building systems, or process systems. May also conduct investment grade audits of buildings or systems."
47-4099.00,47-4099.03,Weatherization Installers and Technicians,"Perform a variety of activities to weatherize homes and make them more energy efficient. Duties include repairing windows, insulating ducts, and performing heating, ventilating, and air-conditioning (HVAC) work. May perform energy audits and advise clients on energy conservation measures."
49-9099.00,49-9099.01,Geothermal Technicians,"Perform technical activities at power plants or individual installations necessary for the generation of power from geothermal energy sources. Monitor and control operating activities at geothermal power generation facilities and perform maintenance and repairs as necessary. Install, test, and maintain residential and commercial geothermal heat pumps."
51-8013.00,51-8013.03,Biomass Plant Technicians,Control and monitor biomass plant activities and perform maintenance as needed.
51-8013.00,51-8013.04,Hydroelectric Plant Technicians,"Monitor and control activities associated with hydropower generation. Operate plant equipment, such as turbines, pumps, valves, gates, fans, electric control boards, and battery banks. Monitor equipment operation and performance and make necessary adjustments to ensure optimal performance. Perform equipment maintenance and repair as necessary."
51-8099.00,51-8099.01,Biofuels Processing Technicians,"Calculate, measure, load, mix, and process refined feedstock with additives in fermentation or reaction process vessels and monitor production process. Perform, and keep records of, plant maintenance, repairs, and safety inspections."
51-9071.00,51-9071.06,Gem and Diamond Workers,"Fabricate, finish, or evaluate the quality of gems and diamonds used in jewelry or industrial tools."
51-9195.00,51-9195.03,"Stone Cutters and Carvers, Manufacturing",Cut or carve stone according to diagrams and patterns.
51-9195.00,51-9195.04,"Glass Blowers, Molders, Benders, and Finishers",Shape molten glass according to patterns.
51-9195.00,51-9195.05,"Potters, Manufacturing","Operate production machines such as pug mill, jigger machine, or potter's wheel to process clay in manufacture of ceramic, pottery and stoneware products."
53-1042.00,53-1042.01,Recycling Coordinators,Supervise curbside and drop-off recycling programs for municipal governments or private firms.
53-6051.00,53-6051.01,Aviation Inspectors,"Inspect aircraft, maintenance procedures, air navigational aids, air traffic controls, and communications equipment to ensure conformance with Federal safety regulations."
53-6051.00,53-6051.07,"Transportation Vehicle, Equipment and Systems Inspectors, Except Aviation","Inspect and monitor transportation equipment, vehicles, or systems to ensure compliance with regulations and safety standards."
53-7062.00,53-7062.04,Recycling and Reclamation Workers,Prepare and sort materials or products for recycling. Identify and remove hazardous substances. Dismantle components of products such as appliances.