SOCLevelCode,SOCDetailCode,SOCDetailTitle,SOCDetailDescription
11-1011.00,11-1011.03,Chief Sustainability Officers,"Communicate and coordinate with management, shareholders, customers, and employees to address sustainability issues. Enact or oversee a corporate sustainability strategy."
11-3013.00,11-3013.01,Security Managers,"Direct an organization's security functions, including physical security and safety of employees and facilities."
11-3031.00,11-3031.01,Treasurers and Controllers,"Direct financial activities, such as planning, procurement, and investments for all or part of an organization."
11-3031.00,11-3031.03,Investment Fund Managers,"Plan, direct, or coordinate investment strategy or operations for a large pool of liquid assets supplied by institutional investors or individual investors."
11-3051.00,11-3051.01,Quality Control Systems Managers,"Plan, direct, or coordinate quality assurance programs. Formulate quality control policies and control quality of laboratory and production efforts."
11-3051.00,11-3051.02,Geothermal Production Managers,Manage operations at geothermal power generation facilities. Maintain and monitor geothermal plant equipment for efficient and safe plant operations.
11-3051.00,11-3051.03,Biofuels Production Managers,"Manage biofuels production and plant operations. Collect and process information on plant production and performance, diagnose problems, and design corrective procedures."
11-3051.00,11-3051.04,Biomass Power Plant Managers,"Manage operations at biomass power generation facilities. Direct work activities at plant, including supervision of operations and maintenance staff."
11-3051.00,11-3051.06,Hydroelectric Production Managers,Manage operations at hydroelectric power generation facilities. Maintain and monitor hydroelectric plant equipment for efficient and safe plant operations.
11-3071.00,11-3071.04,Supply Chain Managers,"Direct or coordinate production, purchasing, warehousing, distribution, or financial forecasting services or activities to limit costs and improve accuracy, customer service, or safety. Examine existing procedures or opportunities for streamlining activities to meet product distribution needs. Direct the movement, storage, or processing of inventory."
11-9041.00,11-9041.01,Biofuels/Biodiesel Technology and Product Development Managers,"Define, plan, or execute biofuels/biodiesel research programs that evaluate alternative feedstock and process technologies with near-term commercial potential."
11-9121.00,11-9121.01,Clinical Research Coordinators,"Plan, direct, or coordinate clinical research projects. Direct the activities of workers engaged in clinical research projects to ensure compliance with protocols and overall clinical objectives. May evaluate and analyze clinical data."
11-9121.00,11-9121.02,Water Resource Specialists,"Design or implement programs and strategies related to water resource issues such as supply, quality, and regulatory compliance issues."
11-9179.00,11-9179.01,Fitness and Wellness Coordinators,"Manage or coordinate fitness and wellness programs and services. Manage and train staff of wellness specialists, health educators, or fitness instructors."
11-9179.00,11-9179.02,Spa Managers,"Plan, direct, or coordinate activities of a spa facility. Coordinate programs, schedule and direct staff, and oversee financial activities."
11-9199.00,11-9199.01,Regulatory Affairs Managers,"Plan, direct, or coordinate production activities of an organization to ensure compliance with regulations and standard operating procedures."
11-9199.00,11-9199.02,Compliance Managers,"Plan, direct, or coordinate activities of an organization to ensure compliance with ethical or regulatory standards."
11-9199.00,11-9199.08,Loss Prevention Managers,"Plan and direct policies, procedures, or systems to prevent the loss of assets. Determine risk exposure or potential liability, and develop risk control measures."
11-9199.00,11-9199.09,Wind Energy Operations Managers,"Manage wind field operations, including personnel, maintenance activities, financial activities, and planning."
11-9199.00,11-9199.10,Wind Energy Development Managers,"Lead or manage the development and evaluation of potential wind energy business opportunities, including environmental studies, permitting, and proposals. May also manage construction of projects."
11-9199.00,11-9199.11,Brownfield Redevelopment Specialists and Site Managers,Plan and direct cleanup and redevelopment of contaminated properties for reuse. Does not include properties sufficiently contaminated to qualify as Superfund sites.
13-1041.00,13-1041.01,Environmental Compliance Inspectors,"Inspect and investigate sources of pollution to protect the public and environment and ensure conformance with Federal, State, and local regulations and ordinances."
13-1041.00,13-1041.03,Equal Opportunity Representatives and Officers,"Monitor and evaluate compliance with equal opportunity laws, guidelines, and policies to ensure that employment practices and contracting arrangements give equal opportunity without regard to race, religion, color, national origin, sex, age, or disability."
13-1041.00,13-1041.04,Government Property Inspectors and Investigators,Investigate or inspect government property to ensure compliance with contract agreements and government regulations.
13-1041.00,13-1041.06,Coroners,"Direct activities such as autopsies, pathological and toxicological analyses, and inquests relating to the investigation of deaths occurring within a legal jurisdiction to determine cause of death or to fix responsibility for accidental, violent, or unexplained deaths."
13-1041.00,13-1041.07,Regulatory Affairs Specialists,"Coordinate and document internal regulatory processes, such as internal audits, inspections, license renewals, or registrations. May compile and prepare materials for submission to regulatory agencies."
13-1041.00,13-1041.08,Customs Brokers,Prepare customs documentation and ensure that shipments meet all applicable laws to facilitate the import and export of goods. Determine and track duties and taxes payable and process payments on behalf of client. Sign documents under a power of attorney. Represent clients in meetings with customs officials and apply for duty refunds and tariff reclassifications. Coordinate transportation and storage of imported goods.
13-1081.00,13-1081.01,Logistics Engineers,"Design or analyze operational solutions for projects such as transportation optimization, network modeling, process and methods analysis, cost containment, capacity enhancement, routing and shipment optimization, or information management."
13-1081.00,13-1081.02,Logistics Analysts,"Analyze product delivery or supply chain processes to identify or recommend changes. May manage route activity including invoicing, electronic bills, and shipment tracing."
13-1161.00,13-1161.01,Search Marketing Strategists,"Employ search marketing tactics to increase visibility and engagement with content, products, or services in Internet-enabled devices or interfaces. Examine search query behaviors on general or specialty search engines or other Internet-based content. Analyze research, data, or technology to understand user intent and measure outcomes for ongoing optimization."
13-1199.00,13-1199.04,Business Continuity Planners,"Develop, maintain, or implement business continuity and disaster recovery strategies and solutions, including risk assessments, business impact analyses, strategy selection, and documentation of business continuity and disaster recovery procedures. Plan, conduct, and debrief regular mock-disaster exercises to test the adequacy of existing plans and strategies, updating procedures and plans regularly. Act as a coordinator for continuity efforts after a disruption event."
13-1199.00,13-1199.05,Sustainability Specialists,"Address organizational sustainability issues, such as waste stream management, green building practices, and green procurement plans."
13-1199.00,13-1199.06,Online Merchants,"Conduct retail activities of businesses operating exclusively online. May perform duties such as preparing business strategies, buying merchandise, managing inventory, implementing marketing activities, fulfilling and shipping online orders, and balancing financial records."
13-1199.00,13-1199.07,Security Management Specialists,"Conduct security assessments for organizations, and design security systems and processes. May specialize in areas such as physical security or the safety of employees and facilities."
13-2099.00,13-2099.01,Financial Quantitative Analysts,"Develop quantitative techniques to inform securities investing, equities investing, pricing, or valuation of financial instruments. Develop mathematical or statistical models for risk management, asset optimization, pricing, or relative value analysis."
13-2099.00,13-2099.04,"Fraud Examiners, Investigators and Analysts","Obtain evidence, take statements, produce reports, and testify to findings regarding resolution of fraud allegations. May coordinate fraud detection and prevention activities."
15-1211.00,15-1211.01,Health Informatics Specialists,"Apply knowledge of nursing and informatics to assist in the design, development, and ongoing modification of computerized health care systems. May educate staff and assist in problem solving to promote the implementation of the health care system."
15-1241.00,15-1241.01,Telecommunications Engineering Specialists,"Design or configure wired, wireless, and satellite communications systems for voice, video, and data services. Supervise installation, service, and maintenance."
15-1243.00,15-1243.01,Data Warehousing Specialists,"Design, model, or implement corporate data warehousing activities. Program and configure warehouses of database information and provide support to warehouse users."
15-1255.00,15-1255.01,Video Game Designers,"Design core features of video games. Specify innovative game and role-play mechanics, story lines, and character biographies. Create and maintain design documentation. Guide and collaborate with production staff to produce games as designed."
15-1299.00,15-1299.01,Web Administrators,"Manage web environment design, deployment, development and maintenance activities. Perform testing and quality assurance of web sites and web applications."
15-1299.00,15-1299.02,Geographic Information Systems Technologists and Technicians,"Assist scientists or related professionals in building, maintaining, modifying, or using geographic information systems (GIS) databases. May also perform some custom application development or provide user support."
15-1299.00,15-1299.03,Document Management Specialists,"Implement and administer enterprise-wide document management systems and related procedures that allow organizations to capture, store, retrieve, share, and destroy electronic records and documents."
15-1299.00,15-1299.04,Penetration Testers,Evaluate network system security by conducting simulated internal and external cyberattacks using adversary tools and techniques. Attempt to breach and exploit critical systems and gain access to sensitive information to assess system security.
15-1299.00,15-1299.05,Information Security Engineers,"Develop and oversee the implementation of information security procedures and policies. Build, maintain and upgrade security technology, such as firewalls, for the safe use of computer networks and the transmission and retrieval of information. Design and implement appropriate security controls to identify vulnerabilities and protect digital files and electronic infrastructures. Monitor and respond to computer security breaches, viruses, and intrusions, and perform forensic investigation. May oversee the assessment of information security systems."
15-1299.00,15-1299.06,Digital Forensics Analysts,"Conduct investigations on computer-based crimes establishing documentary or physical evidence, such as digital media and logs associated with cyber intrusion incidents. Analyze digital evidence and investigate computer security incidents to derive information in support of system and network vulnerability mitigation. Preserve and present computer-related evidence in support of criminal, fraud, counterintelligence, or law enforcement investigations."
15-1299.00,15-1299.07,Blockchain Engineers,"Maintain and support distributed and decentralized blockchain-based networks or block-chain applications such as cryptocurrency exchange, payment processing, document sharing, and digital voting. Design and deploy secure block-chain design patterns and solutions over geographically distributed networks using advanced technologies. May assist with infrastructure setup and testing for application transparency and security."
15-1299.00,15-1299.08,Computer Systems Engineers/Architects,"Design and develop solutions to complex applications problems, system administration issues, or network concerns. Perform systems management and integration functions."
15-1299.00,15-1299.09,Information Technology Project Managers,"Plan, initiate, and manage information technology (IT) projects. Lead and guide the work of technical staff. Serve as liaison between business and technical aspects of projects. Plan project stages and assess business implications for each stage. Monitor progress to assure deadlines, standards, and cost targets are met."
15-2041.00,15-2041.01,Biostatisticians,Develop and apply biostatistical theory and methods to the study of life sciences.
15-2051.00,15-2051.01,Business Intelligence Analysts,Produce financial and market intelligence by querying data repositories and generating periodic reports. Devise methods for identifying data patterns and trends in available information sources.
15-2051.00,15-2051.02,Clinical Data Managers,"Apply knowledge of health care and database management to analyze clinical data, and to identify and report trends."
15-2099.00,15-2099.01,Bioinformatics Technicians,"Apply principles and methods of bioinformatics to assist scientists in areas such as pharmaceuticals, medical technology, biotechnology, computational biology, proteomics, computer information science, biology and medical informatics. Apply bioinformatics tools to visualize, analyze, manipulate or interpret molecular data. May build and maintain databases for processing and analyzing genomic or other biological information."
17-1022.00,17-1022.01,Geodetic Surveyors,"Measure large areas of the Earth's surface using satellite observations, global navigation satellite systems (GNSS), light detection and ranging (LIDAR), or related sources."
17-2051.00,17-2051.01,Transportation Engineers,"Develop plans for surface transportation projects, according to established engineering standards and state or federal construction policy. Prepare designs, specifications, or estimates for transportation facilities. Plan modifications of existing streets, highways, or freeways to improve traffic flow."
17-2051.00,17-2051.02,Water/Wastewater Engineers,"Design or oversee projects involving provision of potable water, disposal of wastewater and sewage, or prevention of flood-related damage. Prepare environmental documentation for water resources, regulatory program compliance, data management and analysis, and field work. Perform hydraulic modeling and pipeline design."
17-2072.00,17-2072.01,Radio Frequency Identification Device Specialists,Design and implement radio frequency identification device (RFID) systems used to track shipments or goods.
17-2111.00,17-2111.02,Fire-Prevention and Protection Engineers,"Research causes of fires, determine fire protection methods, and design or recommend materials or equipment such as structural components or fire-detection equipment to assist organizations in safeguarding life and property against fire, explosion, and related hazards."
17-2112.00,17-2112.01,Human Factors Engineers and Ergonomists,"Design objects, facilities, and environments to optimize human well-being and overall system performance, applying theory, principles, and data regarding the relationship between humans and respective technology. Investigate and analyze characteristics of human behavior and performance as it relates to the use of technology."
17-2112.00,17-2112.02,Validation Engineers,"Design or plan protocols for equipment or processes to produce products meeting internal and external purity, safety, and quality requirements."
17-2112.00,17-2112.03,Manufacturing Engineers,"Design, integrate, or improve manufacturing systems or related processes. May work with commercial or industrial designers to refine product designs to increase producibility and decrease costs."
17-2141.00,17-2141.01,Fuel Cell Engineers,"Design, evaluate, modify, or construct fuel cell components or systems for transportation, stationary, or portable applications."
17-2141.00,17-2141.02,Automotive Engineers,"Develop new or improved designs for vehicle structural members, engines, transmissions, or other vehicle systems, using computer-assisted design technology. Direct building, modification, or testing of vehicle or components."
17-2199.00,17-2199.03,"Energy Engineers, Except Wind and Solar","Design, develop, or evaluate energy-related projects or programs to reduce energy costs or improve energy efficiency during the designing, building, or remodeling stages of construction. May specialize in electrical systems; heating, ventilation, and air-conditioning (HVAC) systems; green buildings; lighting; air quality; or energy procurement."
17-2199.00,17-2199.05,Mechatronics Engineers,"Research, design, develop, or test automation, intelligent systems, smart devices, or industrial systems control."
17-2199.00,17-2199.06,Microsystems Engineers,"Research, design, develop, or test microelectromechanical systems (MEMS) devices."
17-2199.00,17-2199.07,Photonics Engineers,"Design technologies specializing in light information or light energy, such as laser or fiber optics technology."
17-2199.00,17-2199.08,Robotics Engineers,"Research, design, develop, or test robotic applications."
17-2199.00,17-2199.09,Nanosystems Engineers,"Design, develop, or supervise the production of materials, devices, or systems of unique molecular or macromolecular composition, applying principles of nanoscale physics and electrical, chemical, or biological engineering."
17-2199.00,17-2199.10,Wind Energy Engineers,Design underground or overhead wind farm collector systems and prepare and develop site specifications.
17-2199.00,17-2199.11,Solar Energy Systems Engineers,"Perform site-specific engineering analysis or evaluation of energy efficiency and solar projects involving residential, commercial, or industrial customers. Design solar domestic hot water and space heating systems for new and existing structures, applying knowledge of structural energy requirements, local climates, solar technology, and thermodynamics."
17-3024.00,17-3024.01,Robotics Technicians,"Build, install, test, or maintain robotic equipment or related automated production systems."
17-3026.00,17-3026.01,Nanotechnology Engineering Technologists and Technicians,"Implement production processes and operate commercial-scale production equipment to produce, test, or modify materials, devices, or systems of unique molecular or macromolecular composition. Operate advanced microscopy equipment to manipulate nanoscale objects. Work under the supervision of nanoengineering staff."
17-3027.00,17-3027.01,Automotive Engineering Technicians,"Assist engineers in determining the practicality of proposed product design changes and plan and carry out tests on experimental test devices or equipment for performance, durability, or efficiency."
17-3029.00,17-3029.01,Non-Destructive Testing Specialists,"Test the safety of structures, vehicles, or vessels using x-ray, ultrasound, fiber optic or related equipment."
17-3029.00,17-3029.08,Photonics Technicians,"Build, install, test, or maintain optical or fiber optic equipment, such as lasers, lenses, or mirrors, using spectrometers, interferometers, or related equipment."
19-1029.00,19-1029.01,Bioinformatics Scientists,"Conduct research using bioinformatics theory and methods in areas such as pharmaceuticals, medical technology, biotechnology, computational biology, proteomics, computer information science, biology and medical informatics. May design databases and develop algorithms for processing and analyzing genomic information, or other biological information."
19-1029.00,19-1029.02,Molecular and Cellular Biologists,Research and study cellular molecules and organelles to understand cell function and organization.
19-1029.00,19-1029.03,Geneticists,"Research and study the inheritance of traits at the molecular, organism or population level. May evaluate or treat patients with genetic disorders."
19-1029.00,19-1029.04,Biologists,"Research or study basic principles of plant and animal life, such as origin, relationship, development, anatomy, and functions."
19-1031.00,19-1031.02,Range Managers,"Research or study range land management practices to provide sustained production of forage, livestock, and wildlife."
19-1031.00,19-1031.03,Park Naturalists,"Plan, develop, and conduct programs to inform public of historical, natural, and scientific features of national, state, or local park."
19-2041.00,19-2041.01,Climate Change Policy Analysts,"Research and analyze policy developments related to climate change. Make climate-related recommendations for actions such as legislation, awareness campaigns, or fundraising approaches."
19-2041.00,19-2041.02,Environmental Restoration Planners,"Collaborate with field and biology staff to oversee the implementation of restoration projects and to develop new products. Process and synthesize complex scientific data into practical strategies for restoration, monitoring or management."
19-2041.00,19-2041.03,Industrial Ecologists,Apply principles and processes of natural ecosystems to develop models for efficient industrial systems. Use knowledge from the physical and social sciences to maximize effective use of natural resources in the production and use of goods and services. Examine societal issues and their relationship with both technical systems and the environment.
19-2099.00,19-2099.01,Remote Sensing Scientists and Technologists,"Apply remote sensing principles and methods to analyze data and solve problems in areas such as natural resource management, urban planning, or homeland security. May develop new sensor systems, analytical techniques, or new applications for existing systems."
19-3011.00,19-3011.01,Environmental Economists,"Conduct economic analysis related to environmental protection and use of the natural environment, such as water, air, land, and renewable energy resources. Evaluate and quantify benefits, costs, incentives, and impacts of alternative options using economic principles and statistical techniques."
19-3039.00,19-3039.02,Neuropsychologists,"Apply theories and principles of neuropsychology to evaluate and diagnose disorders of higher cerebral functioning, often in research and medical settings. Study the human brain and the effect of physiological states on human cognition and behavior. May formulate and administer programs of treatment."
19-3039.00,19-3039.03,Clinical Neuropsychologists,"Assess and diagnosis patients with neurobehavioral problems related to acquired or developmental disorders of the nervous system, such as neurodegenerative disorders, traumatic brain injury, seizure disorders, and learning disabilities. Recommend treatment after diagnosis, such as therapy, medication, or surgery. Assist with evaluation before and after neurosurgical procedures, such as deep brain stimulation."
19-3099.00,19-3099.01,Transportation Planners,"Prepare studies for proposed transportation projects. Gather, compile, and analyze data. Study the use and operation of transportation systems. Develop transportation models or simulations."
19-4012.00,19-4012.01,Precision Agriculture Technicians,"Apply geospatial technologies, including geographic information systems (GIS) and Global Positioning System (GPS), to agricultural production or management activities, such as pest scouting, site-specific pesticide application, yield mapping, or variable-rate irrigation. May use computers to develop or analyze maps or remote sensing images to compare physical topography with data on soils, fertilizer, pests, or weather."
19-4051.00,19-4051.02,Nuclear Monitoring Technicians,"Collect and test samples to monitor results of nuclear experiments and contamination of humans, facilities, and environment."
19-4099.00,19-4099.01,Quality Control Analysts,"Conduct tests to determine quality of raw materials, bulk intermediate and finished products. May conduct stability sample tests."
19-4099.00,19-4099.03,Remote Sensing Technicians,"Apply remote sensing technologies to assist scientists in areas such as natural resources, urban planning, or homeland security. May prepare flight plans or sensor configurations for flight trips."
25-2059.00,25-2059.01,Adapted Physical Education Specialists,"Provide individualized physical education instruction or services to children, youth, or adults with exceptional physical needs due to gross motor developmental delays or other impairments."
27-2012.00,27-2012.03,Media Programming Directors,"Direct and coordinate activities of personnel engaged in preparation of radio or television station program schedules and programs, such as sports or news."
27-2012.00,27-2012.04,Talent Directors,"Audition and interview performers to select most appropriate talent for parts in stage, television, radio, or motion picture productions."
27-2012.00,27-2012.05,Media Technical Directors/Managers,"Coordinate activities of technical departments, such as taping, editing, engineering, and maintenance, to produce radio or television programs."
